wav_filename,wav_filesize,transcript
/home/testuser/git-lfs-2.2.0/deepspeech/data/cmu/allo_carbon_31.wav,237648,carbon black is used as a black pigment in black ink and as a filler in automobile tires
/home/testuser/git-lfs-2.2.0/deepspeech/data/cmu/amphibolic_11.wav,206516,glycerol is then converted into pgal an intermediary substrate of glycolysis
/home/testuser/git-lfs-2.2.0/deepspeech/data/cmu/amphibolic_12.wav,323544,in the same way fatty acids are broken down to form acetyl coa an intermediary substrate of the krebs cycle
/home/testuser/git-lfs-2.2.0/deepspeech/data/cmu/amphibolic_13.wav,193142,similarly proteins are broken down by protease enzymes into amino acids
/home/testuser/git-lfs-2.2.0/deepspeech/data/cmu/amphibolic_14.wav,262522,these amino acids are converted into different intermediary substrates of the krebs cycle such as pyruvate
/home/testuser/git-lfs-2.2.0/deepspeech/data/cmu/amphibolic_15.wav,380386,thus in addition to glucose plants use fats and proteins as respiratory substrates to produce energy these processes describe the role of
/home/testuser/git-lfs-2.2.0/deepspeech/data/cmu/amphibolic_17.wav,336920,the respiratory pathway also plays a role in anabolism the synthesis of complex substances like carbohydrates fats and proteins
/home/testuser/git-lfs-2.2.0/deepspeech/data/cmu/amphibolic_18.wav,284256,when the plant requires proteins or carbohydrates it can synthesise them by withdrawing some of the substrates in the respiratory pathway
/home/testuser/git-lfs-2.2.0/deepspeech/data/cmu/amphibolic_19.wav,305990,for example the pep formed during glycolysis is withdrawn and used for the synthesis of proteins or carbohydrates
/home/testuser/git-lfs-2.2.0/deepspeech/data/cmu/amphibolic_20.wav,352802,likewise if the plant requires fats it withdraws acetyl coa and citrate from the krebs cycle to synthesise them
/home/testuser/git-lfs-2.2.0/deepspeech/data/cmu/amphibolic_21.wav,309334,thus the respiratory pathway is involved in both catabolism and anabolism and is called an amphibolic pathway
/home/testuser/git-lfs-2.2.0/deepspeech/data/cmu/amphibolic_22.wav,258342,as you know aerobic respiration involves the consumption of oxygen and expulsion of carbon dioxide
/home/testuser/git-lfs-2.2.0/deepspeech/data/cmu/amphibolic_23.wav,425526,the respiratory quotient rq or respiratory ratio is calculated based on the volume of carbon dioxide expelled to the volume of oxygen consumed
/home/testuser/git-lfs-2.2.0/deepspeech/data/cmu/amphibolic_24.wav,230758,as plants use more than one substrate for respiration rq depends on the respiratory substrate used
/home/testuser/git-lfs-2.2.0/deepspeech/data/cmu/amphibolic_25.wav,253328,for example when carbohydrates are used as the respiratory substrate the rq value is 1
/home/testuser/git-lfs-2.2.0/deepspeech/data/cmu/amphibolic_26.wav,239116,which means the volume of carbon dioxide expelled equals the volume of oxygen consumed
/home/testuser/git-lfs-2.2.0/deepspeech/data/cmu/amphibolic_27.wav,264194,but when fats or proteins are used as the respiratory substrate the rq value is less than 1
/home/testuser/git-lfs-2.2.0/deepspeech/data/cmu/amphibolic_28.wav,239116,that is 0 point 7 for fats and 0 point 9 for proteins
/home/testuser/git-lfs-2.2.0/deepspeech/data/cmu/amphibolic_29.wav,224070,which means the volume of carbon dioxide expelled is less than the volume of oxygen consumed
/home/testuser/git-lfs-2.2.0/deepspeech/data/cmu/amphibolic_2.wav,173916,in this module you will learn about the amphibolic pathway in plants
/home/testuser/git-lfs-2.2.0/deepspeech/data/cmu/amphibolic_30.wav,208188,this is why glucose is used as the primary substrate for respiration by plants
/home/testuser/git-lfs-2.2.0/deepspeech/data/cmu/amphibolic_3.wav,225742,the amphibolic pathway involves both catabolism and anabolism
/home/testuser/git-lfs-2.2.0/deepspeech/data/cmu/amphibolic_4.wav,228250,where catabolism stands for the breakdown of complex substances to produce energy and
/home/testuser/git-lfs-2.2.0/deepspeech/data/cmu/amphibolic_5.wav,191470,anabolism stands for the synthesis of complex substance from simple substances
/home/testuser/git-lfs-2.2.0/deepspeech/data/cmu/amphibolic_6.wav,348622,so far we have seen how the glucose substrate is oxidised during glycolysis and observed the krebs cycle during aerobic respiration
/home/testuser/git-lfs-2.2.0/deepspeech/data/cmu/amphibolic_7.wav,228250,but plants also use substances such as fats and proteins as respiratory substrates
/home/testuser/git-lfs-2.2.0/deepspeech/data/cmu/amphibolic_8.wav,336920,though pure fats or proteins cannot be directly used as substrates they can enter as intermediary substrates of glycolysis and the krebs cycle
/home/testuser/git-lfs-2.2.0/deepspeech/data/cmu/amphibolic_9.wav,186454,now lets see how fats and proteins are utilised as respiratory substrates
/home/testuser/git-lfs-2.2.0/deepspeech/data/cmu/angiosperms_03.wav,647044,you must have come across banana plantations apple orchards or herbs such as basil you may have also seen flowers such as lotus and roses growing in ponds and gardens all these are species of flowering plants also called angiosperms
/home/testuser/git-lfs-2.2.0/deepspeech/data/cmu/angiosperms_07.wav,265866,a typical flower of an angiosperm contains the stamen and the pistil the male and female sex organs respectively
/home/testuser/git-lfs-2.2.0/deepspeech/data/cmu/angiosperms_09.wav,182274,the microsporangia inside the anther contain the microspore mother cells
/home/testuser/git-lfs-2.2.0/deepspeech/data/cmu/angiosperms_10.wav,331068,these mother cells undergo meiosis to produce microspores which then develop into pollen grains the male gametophytes
/home/testuser/git-lfs-2.2.0/deepspeech/data/cmu/angiosperms_12.wav,244968,on the other hand the pistil consists of the stigma at the tip followed by the style in the middle and an ovary at the base
/home/testuser/git-lfs-2.2.0/deepspeech/data/cmu/angiosperms_13.wav,187290,the ovules or the megasproangia are present inside the ovary
/home/testuser/git-lfs-2.2.0/deepspeech/data/cmu/angiosperms_15.wav,227414,which following meiosis develops into the haploid female gametophyte called the embryo sac
/home/testuser/git-lfs-2.2.0/deepspeech/data/cmu/angiosperms_16.wav,407136,the embryo sac has a three celled egg apparatus consisting of one egg cell two synergids three antipodal cells and two polar nuclei
/home/testuser/git-lfs-2.2.0/deepspeech/data/cmu/angiosperms_17.wav,318528,the polar nuclei eventually fuse to produce a diploid secondary nucleus the embryo sac now becomes ready for fertilisation
/home/testuser/git-lfs-2.2.0/deepspeech/data/cmu/angiosperms_18.wav,197320,which in the case of angiosperms takes place by a process called pollination
/home/testuser/git-lfs-2.2.0/deepspeech/data/cmu/angiosperms_19.wav,402956,during pollination the anther disperses the pollen grains which are then carried by agents such as the wind and insects and are deposited over the stigma of a pistil
/home/testuser/git-lfs-2.2.0/deepspeech/data/cmu/angiosperms_20.wav,396270,here the pollen grain germinates and produces a pollen tube this tube penetrates the tissues of the stigma and style to enter the embryo sac inside the ovule
/home/testuser/git-lfs-2.2.0/deepspeech/data/cmu/angiosperms_21.wav,530016,it discharges two male gametes inside the embryo sac while one gamete fuses with the egg cell to produce a zygote the other gamete fuses with the diploid secondary nucleus to produce the triploid primary endosperm nucleus
/home/testuser/git-lfs-2.2.0/deepspeech/data/cmu/angiosperms_22.wav,371192,this event is called double fertilisation as it involves two fusions interestingly double fertilisation is observed only in angiosperms
/home/testuser/git-lfs-2.2.0/deepspeech/data/cmu/angiosperms_23.wav,786644,after fertilisation the synergids and antipodals degenerate on the other hand the zygote develops into an embryo and the primary endosperm nucleus develops into endosperm which nourishes the zygote simultaneously the ovule develops into a seed and the ovary into fruit
/home/testuser/git-lfs-2.2.0/deepspeech/data/cmu/angiosperms_25.wav,336084,angiosperms are one of the biggest plant groups and they grow in diverse habitats such as land and water as well as in different climatic conditions
/home/testuser/git-lfs-2.2.0/deepspeech/data/cmu/angiosperms_26.wav,447260,besides being a source of food they supply us with fuel fodder and medicines thus angiosperms form an integral part of the eco system as well as of our daily lives
/home/testuser/git-lfs-2.2.0/deepspeech/data/cmu/animal_classification_10.wav,220726,whereas humans have a complete digestive system that has two openings a mouth and an anus
/home/testuser/git-lfs-2.2.0/deepspeech/data/cmu/animal_classification_11.wav,214040,you will also find two types of circulatory systems in animals open and closed
/home/testuser/git-lfs-2.2.0/deepspeech/data/cmu/animal_classification_13.wav,621132,they can be asymmetrical like sponges or have radial symmetry like coelenterates ctenophores and echinoderms however most animals like annelids and arthropods have bilateral symmetry
/home/testuser/git-lfs-2.2.0/deepspeech/data/cmu/animal_classification_15.wav,194812,there are two types of cell organisation diploblastic and triploblastic
/home/testuser/git-lfs-2.2.0/deepspeech/data/cmu/animal_classification_16.wav,366176,coelenterates have diploblastic organisation where the germinal layers of the cell consist of an external ectoderm and an internal endoderm
/home/testuser/git-lfs-2.2.0/deepspeech/data/cmu/animal_classification_17.wav,492400,members from phylum platyhelminthes to chordates have triploblastic organisation where a third germinal layer the mesoderm is found between the ectoderm and the endoderm
/home/testuser/git-lfs-2.2.0/deepspeech/data/cmu/animal_classification_18.wav,194812,the fourth important feature by which animals are classified is the nature of coelom
/home/testuser/git-lfs-2.2.0/deepspeech/data/cmu/animal_classification_19.wav,301810,the coelom is the body cavity lined by mesoderm the presence or absence of this cavity helps classify animals
/home/testuser/git-lfs-2.2.0/deepspeech/data/cmu/animal_classification_1.wav,234938,with over a million animal species on our earth it would be difficult to categorise them into different groups
/home/testuser/git-lfs-2.2.0/deepspeech/data/cmu/animal_classification_20.wav,286764,there are three categories coelomates acoelomates and pseudocoelomates
/home/testuser/git-lfs-2.2.0/deepspeech/data/cmu/animal_classification_21.wav,450604,coelomates are animals that possess a body cavity such as annelids molluscs arthropods echinoderms hemichordates and chordates
/home/testuser/git-lfs-2.2.0/deepspeech/data/cmu/animal_classification_22.wav,244132,acoelomates are animals in which the body cavity is absent such as platyhelminthes
/home/testuser/git-lfs-2.2.0/deepspeech/data/cmu/animal_classification_23.wav,572648,pseudocoelomates are animals that possess a pseudocoelom such as aschelminthes a pseudocoelom is a body cavity in which the mesoderm is not lined but rather scattered between the ectoderm and the endoderm
/home/testuser/git-lfs-2.2.0/deepspeech/data/cmu/animal_classification_25.wav,196484,the body of some animals can be divided externally and internally into segments
/home/testuser/git-lfs-2.2.0/deepspeech/data/cmu/animal_classification_26.wav,405464,sometimes the segments in animals have serial repetition of some organs which is seen is earthworms this phenomenon is also known as metamerism
/home/testuser/git-lfs-2.2.0/deepspeech/data/cmu/animal_classification_27.wav,215710,one of the most important features for animal classification is the presence or absence of a notochord
/home/testuser/git-lfs-2.2.0/deepspeech/data/cmu/animal_classification_28.wav,287600,some animals develop a rod like structure on the dorsal side during embryonic development which known as the notochord
/home/testuser/git-lfs-2.2.0/deepspeech/data/cmu/animal_classification_29.wav,456456,animals with a notochord are called chordates while animals without a notochord are called non chordates members of phylum porifera to echinoderms are non chordates
/home/testuser/git-lfs-2.2.0/deepspeech/data/cmu/animal_classification_2.wav,574320,however with the help of basic fundamental features such as level of organisation symmetry cell organisation nature of coelom segmentation and notochord scientists have classified animals into various groups
/home/testuser/git-lfs-2.2.0/deepspeech/data/cmu/animal_classification_30.wav,219890,we just studied how we can classify animals into different categories on the basis of some fundamental features
/home/testuser/git-lfs-2.2.0/deepspeech/data/cmu/animal_classification_3.wav,422182,lets understand each of these basic fundamental features in detail level of organisation is the first basic fundamental feature that deals with the pattern of cell organisation in an animal
/home/testuser/git-lfs-2.2.0/deepspeech/data/cmu/animal_classification_4.wav,287600,there are four patterns of cell organisation cellular tissue organ and organ system
/home/testuser/git-lfs-2.2.0/deepspeech/data/cmu/animal_classification_5.wav,188962,sponges exhibit a cellular level of organisation where cells are loosely arranged
/home/testuser/git-lfs-2.2.0/deepspeech/data/cmu/animal_classification_6.wav,425526,tissue level of organisation is more complex and is displayed in coelenterates here the cells that perform the same function are arranged into tissues
/home/testuser/git-lfs-2.2.0/deepspeech/data/cmu/animal_classification_7.wav,470666,organ level of organisation is exhibited in members of platyhelminthes and other higher phyla here the tissues are grouped to form organs and each organ performs a particular function
/home/testuser/git-lfs-2.2.0/deepspeech/data/cmu/animal_classification_8.wav,816736,the last cell pattern is the organ system level of organisation here the organs are associated with one another to form a functional system where each system performs a specific physiological function animals like annelids arthropods molluscs echinoderms and chordates exhibit this level of organisation organ systems can also differ in complexity in various animal groups
/home/testuser/git-lfs-2.2.0/deepspeech/data/cmu/animal_classification_9.wav,375372,for example platyhelminthes have an incomplete digestive system where a single opening outside the body serves as both the mouth and the anus
/home/testuser/git-lfs-2.2.0/deepspeech/data/cmu/asexual_reprod_02.wav,181438,in this module you will learn about asexual reproduction in organisms
/home/testuser/git-lfs-2.2.0/deepspeech/data/cmu/asexual_reprod_03.wav,434722,our earth is home to countless plant and animal species all of which have a limited life span and are bound to die yet these species have existed for several thousands of years
/home/testuser/git-lfs-2.2.0/deepspeech/data/cmu/asexual_reprod_04.wav,192306,thats because living organisms can reproduce that is they give rise to offspring
/home/testuser/git-lfs-2.2.0/deepspeech/data/cmu/asexual_reprod_05.wav,353638,which in turn grow and reproduce their own offspring of the same kind this ensures survival of the species generation after generation
/home/testuser/git-lfs-2.2.0/deepspeech/data/cmu/asexual_reprod_06.wav,235772,in living organisms we see two types of reproduction sexual and asexual
/home/testuser/git-lfs-2.2.0/deepspeech/data/cmu/asexual_reprod_07.wav,270046,in sexual reproduction a gamete from the male parent fuses with a gamete from the female parent to form a zygote
/home/testuser/git-lfs-2.2.0/deepspeech/data/cmu/asexual_reprod_08.wav,416332,however in asexual reproduction the organism or the parent cell divides to give rise to morphologically and genetically identical organisms called clones
/home/testuser/git-lfs-2.2.0/deepspeech/data/cmu/asexual_reprod_09.wav,314350,asexual reproduction commonly seen in protists monerans and fungi is of many different types
/home/testuser/git-lfs-2.2.0/deepspeech/data/cmu/asexual_reprod_10.wav,353638,the amoeba for instance reproduces by binary fission where the parent cell divides into two halves and each half develops into a daughter cell
/home/testuser/git-lfs-2.2.0/deepspeech/data/cmu/asexual_reprod_11.wav,175586,likewise bacteria too reproduce through binary fission
/home/testuser/git-lfs-2.2.0/deepspeech/data/cmu/asexual_reprod_12.wav,268374,yeast on the other hand reproduces through budding where the parent cell produces small buds through mitosis
/home/testuser/git-lfs-2.2.0/deepspeech/data/cmu/asexual_reprod_13.wav,235772,these buds initially remain attached to the parent cell and then separate to develop into new organisms
/home/testuser/git-lfs-2.2.0/deepspeech/data/cmu/asexual_reprod_14.wav,398778,while yeast reproduces through budding other members of the fungi kingdom such as penicilium reproduce through conida a special asexual reproductive structure
/home/testuser/git-lfs-2.2.0/deepspeech/data/cmu/asexual_reprod_15.wav,272554,apart from fungi we also see asexual reproductive structures in certain members of kindgom animalia
/home/testuser/git-lfs-2.2.0/deepspeech/data/cmu/asexual_reprod_16.wav,234938,in the case of hydra buds which develop on the parent body serve as a means of reproduction
/home/testuser/git-lfs-2.2.0/deepspeech/data/cmu/asexual_reprod_17.wav,291780,likewise the sponge produces internal buds called gemmules that aid in asexual reproduction
/home/testuser/git-lfs-2.2.0/deepspeech/data/cmu/asexual_reprod_18.wav,394598,apart from single celled organisms and animals asexual reproduction is also seen in simple plants such as algae as well as in certain higher plants such as potato
/home/testuser/git-lfs-2.2.0/deepspeech/data/cmu/asexual_reprod_19.wav,314350,for instance chlamydomonas a type of algae develops zoospores which later mature into new plants
/home/testuser/git-lfs-2.2.0/deepspeech/data/cmu/asexual_reprod_20.wav,353638,however during unfavourable conditions chlamydomonas as well as other types of fungi and algae undergo sexual reproduction
/home/testuser/git-lfs-2.2.0/deepspeech/data/cmu/asexual_reprod_21.wav,461470,in higher plants asexual reproduction commonly known as vegetative propagation takes place through vegetative propagules specialised structures which emerge from different parts of the plant
/home/testuser/git-lfs-2.2.0/deepspeech/data/cmu/asexual_reprod_22.wav,306826,for instance the stem of a potato plant is dotted with buds known as eyes which later germinate into new plants
/home/testuser/git-lfs-2.2.0/deepspeech/data/cmu/asexual_reprod_23.wav,330232,whereas in a ginger plant modified stems or rhizomes having nodes and buds act as a means of vegetative propagation
/home/testuser/git-lfs-2.2.0/deepspeech/data/cmu/asexual_reprod_24.wav,392926,while the buds develop into a new ginger plant the nodes of the rhizome give way to adventitious roots which help in the absorption of water and minerals from the soil
/home/testuser/git-lfs-2.2.0/deepspeech/data/cmu/asexual_reprod_25.wav,372864,bryophyllum on the other hand have notches on the margin of their leaves that give rise to adventitious buds that fall off and later germinate into new plantlets
/home/testuser/git-lfs-2.2.0/deepspeech/data/cmu/asexual_reprod_26.wav,387074,apart from buds and nodes runners suckers offsets and bulbs are other examples of vegetative propagules in plants
/home/testuser/git-lfs-2.2.0/deepspeech/data/cmu/asexual_reprod_27.wav,388746,interestingly farmers and gardeners make full use of vegetative propagation for commercial cultivation of various plants including strawberry potatoes and ginger
/home/testuser/git-lfs-2.2.0/deepspeech/data/cmu/asexual_reprod_28.wav,716426,vegetative propagation however can turn into a problem in certain cases like the fishermen of bengal have discovered water hyacinth an aquatic plant with a phenomenal rate of vegetative propagation is choking the bay of bengal and killing millions of fish thereby ruining the livelihood of the fishing community
/home/testuser/git-lfs-2.2.0/deepspeech/data/cmu/asexual_reprod_29.wav,321872,asexual reproduction an important biological process that ensures continuity of life occurs differently in different organisms
/home/testuser/git-lfs-2.2.0/deepspeech/data/cmu/bee_keeping_10.wav,218218,due to the increasing demand for honey bee keeping is done both on a small scale and large scale
/home/testuser/git-lfs-2.2.0/deepspeech/data/cmu/bee_keeping_11.wav,214876,in small scale bee keeping one or two apiaries are kept in verandas or on rooftops
/home/testuser/git-lfs-2.2.0/deepspeech/data/cmu/bee_keeping_12.wav,164720,whereas in large scale bee keeping many apiaries are used
/home/testuser/git-lfs-2.2.0/deepspeech/data/cmu/bee_keeping_14.wav,177258,bee keeping is usually practised near fruit plantations and cultivated fields
/home/testuser/git-lfs-2.2.0/deepspeech/data/cmu/bee_keeping_15.wav,188962,honeybees act as pollinators by helping crops like sunflower during flowering
/home/testuser/git-lfs-2.2.0/deepspeech/data/cmu/bee_keeping_17.wav,188962,as a result farmers get a high yield in terms of crops as well as honey
/home/testuser/git-lfs-2.2.0/deepspeech/data/cmu/bee_keeping_18.wav,244132,the most commonly reared honeybee species is apis indica also called the indian bee
/home/testuser/git-lfs-2.2.0/deepspeech/data/cmu/bee_keeping_20.wav,177258,it does require some knowledge and training that is provided by certain organisations
/home/testuser/git-lfs-2.2.0/deepspeech/data/cmu/bee_keeping_28.wav,255000,and relates to the rearing catching and selling of aquatic animals such as fish and shellfish
/home/testuser/git-lfs-2.2.0/deepspeech/data/cmu/bee_keeping_29.wav,191470,as fish contain more proteins and less fat they are preferred to other meats
/home/testuser/git-lfs-2.2.0/deepspeech/data/cmu/bee_keeping_30.wav,231594,most commonly eaten freshwater fish include catla rohu and the common carp
/home/testuser/git-lfs-2.2.0/deepspeech/data/cmu/bee_keeping_31.wav,188126,while marine fish include hilsa mackerel and pomfret
/home/testuser/git-lfs-2.2.0/deepspeech/data/cmu/bee_keeping_32.wav,335248,fisheries also provide products such as cod liver oil which is a nutritional supplement and pearl oysters that have commercial value
/home/testuser/git-lfs-2.2.0/deepspeech/data/cmu/bee_keeping_33.wav,178094,consequently it forms the livelihood of many people in coastal areas of india
/home/testuser/git-lfs-2.2.0/deepspeech/data/cmu/bee_keeping_34.wav,218218,as seafood like fish prawn crab and lobster are always in demand
/home/testuser/git-lfs-2.2.0/deepspeech/data/cmu/bee_keeping_35.wav,226578,several techniques like aquaculture and pisciculture are employed to increase their yield
/home/testuser/git-lfs-2.2.0/deepspeech/data/cmu/bee_keeping_36.wav,174750,aquaculture is the cultivation of aquatic animals and plants for food
/home/testuser/git-lfs-2.2.0/deepspeech/data/cmu/bee_keeping_37.wav,166392,whereas pisciculture refers specifically to fish farming
/home/testuser/git-lfs-2.2.0/deepspeech/data/cmu/bee_keeping_38.wav,355310,this dramatic increase in seafood production was called the blue revolution compared to the green revolution that brought about an increase in agricultural production
/home/testuser/git-lfs-2.2.0/deepspeech/data/cmu/bee_keeping_3.wav,214876,animal husbandry includes bee keeping and fisheries in addition to cattle and poultry farming
/home/testuser/git-lfs-2.2.0/deepspeech/data/cmu/bee_keeping_4.wav,203172,bee keeping also known as apiculture is the rearing of honeybees
/home/testuser/git-lfs-2.2.0/deepspeech/data/cmu/bee_keeping_5.wav,188962,in artificial beehives called apiaries for the commercial production of honey
/home/testuser/git-lfs-2.2.0/deepspeech/data/cmu/bee_keeping_6.wav,173080,honey is highly nutritious and an important constituent of several medicines
/home/testuser/git-lfs-2.2.0/deepspeech/data/cmu/bee_keeping_7.wav,194812,also the apiaries in which honeybees live and nurture their young ones
/home/testuser/git-lfs-2.2.0/deepspeech/data/cmu/biodiversity_10.wav,467322,unfortunately many nations believe that this type of conservation is unrealistic and uneconomical and so a number of species that need to be saved from extinction outnumber the conservational aid available
/home/testuser/git-lfs-2.2.0/deepspeech/data/cmu/biodiversity_11.wav,547570,to solve this problem on a global scale conservationists have identified biodiversity hotspots in the world initially there were 25 biodiversity hotspots in the world which was later increased to 34
/home/testuser/git-lfs-2.2.0/deepspeech/data/cmu/biodiversity_12.wav,397106,though these 34 biodiversity hotspots cover less than 2 per cent of the earths land area they are inhabited by an extremely large number of species and a high degree of endemism
/home/testuser/git-lfs-2.2.0/deepspeech/data/cmu/biodiversity_13.wav,224906,the term endemism relates to species that are confined to a particular region and not found elsewhere
/home/testuser/git-lfs-2.2.0/deepspeech/data/cmu/biodiversity_14.wav,195648,for example many species of lemur are endemic to madagascar island
/home/testuser/git-lfs-2.2.0/deepspeech/data/cmu/biodiversity_15.wav,186454,likewise the lion tailed macaque is endemic to the western ghats of india
/home/testuser/git-lfs-2.2.0/deepspeech/data/cmu/biodiversity_16.wav,430542,our country too is rich in biodiversity with three biodiversity hotspots which include the western ghats himalayas and indo burma region
/home/testuser/git-lfs-2.2.0/deepspeech/data/cmu/biodiversity_17.wav,396270,regions with unique ecology and rich biodiversity are legally protected as biosphere reserves national parks and sanctuaries
/home/testuser/git-lfs-2.2.0/deepspeech/data/cmu/biodiversity_18.wav,389582,as of today we have 14 biosphere reserves 90 national parks and 448 wildlife sanctuaries in our country
