wav_filename,wav_filesize,transcript
/home/testuser/git-lfs-2.2.0/deepspeech/data/cmu/idgah_101.wav,918870,all it needed was the milk of a banyan sapling the milk was brought and the broken leg reassembled but no sooner was the constable put on his feet the leg gave way one leg was of no use because now he could neither walk nor sit mahmood became a surgeon and cut the other leg to the size of the broken one so the chap could at least sit in comfort
/home/testuser/git-lfs-2.2.0/deepspeech/data/cmu/idgah_102.wav,590354,let us complete an activity underline the lines which reveal the fate hamids friends toys had to face click next to continue here are the lines which reveal the fate hamids friends toys had to face
/home/testuser/git-lfs-2.2.0/deepspeech/data/cmu/idgah_103.wav,246792,mahmoods policeman suffered badly as it lost one of its leg and then withered away gradually
/home/testuser/git-lfs-2.2.0/deepspeech/data/cmu/idgah_104.wav,505926,here is another activity has it ever happened to you that you bought a toy but it broke soon after you brought it home how did you feel click next to continue after the discussion
/home/testuser/git-lfs-2.2.0/deepspeech/data/cmu/idgah_105.wav,459952,do you think hamids friends felt the same way about their toys was their reaction in any way different from yours discuss in class click next to continue
/home/testuser/git-lfs-2.2.0/deepspeech/data/cmu/idgah_107.wav,798498,as soon as she heard his voice granny ameena ran out of the house picked him up and kissed him suddenly she noticed the tongs in his hand where did you find these tongs i bought them how much did you pay for them three pice granny ameena beat her breast
/home/testuser/git-lfs-2.2.0/deepspeech/data/cmu/idgah_108.wav,918870,the old womans temper suddenly changed to love not the kind of calculated love which wastes away in spoken words this love was mute solid and seeped with tenderness what a selfless child what concern for others what a big heart how he must have suffered seeing other boys buying toys and gobbling sweets
/home/testuser/git-lfs-2.2.0/deepspeech/data/cmu/idgah_109.wav,490044,time for an activity now since weve come to the end of the story tick the words which describe the story accurately in the handouts click the lets check tab to check your responses
/home/testuser/git-lfs-2.2.0/deepspeech/data/cmu/idgah_10.wav,296110,idgah is one of the most popular stories written by munshi premchand it was published in the year 1938
/home/testuser/git-lfs-2.2.0/deepspeech/data/cmu/idgah_110.wav,863700,the story describes the sacrifice which hamid made to show his respect and love for his grandmother ameena he is an optimistic child who doesnt get deterred by the fancy material things around him ameenas behaviour on the other hand shows her love and care for her only grandson hamid click next to continue
/home/testuser/git-lfs-2.2.0/deepspeech/data/cmu/idgah_111.wav,291932,we will now look at each element of the story individually remember that not all stories will have each of the elements
/home/testuser/git-lfs-2.2.0/deepspeech/data/cmu/idgah_112.wav,373016,first we will look at the setting there are two aspects to consider under setting the location of the story and the time and date when the story takes place
/home/testuser/git-lfs-2.2.0/deepspeech/data/cmu/idgah_113.wav,172396,the story is set in rural india in the pre independence era
/home/testuser/git-lfs-2.2.0/deepspeech/data/cmu/idgah_114.wav,942276,stories must have at least one character most stories usually have a protagonist and an antagonist the protagonist is the main character of the story whereas antagonist is the person opposing the protagonist the antagonist is usually a negative character a story might not have an antagonist then there are the secondary characters
/home/testuser/git-lfs-2.2.0/deepspeech/data/cmu/idgah_115.wav,300290,hamid is undoubtedly the protagonist of the story granny and hamids friends are the secondary characters
/home/testuser/git-lfs-2.2.0/deepspeech/data/cmu/idgah_116.wav,900480,next we will look at the plot plot is the structure of a story it refers to the events that make up the story the initial event is the exposition or the way the story is introduced to the reader soon after the exposition the central problem of the story is presented this is the conflict in the plot an event that takes the plot of the story forward
/home/testuser/git-lfs-2.2.0/deepspeech/data/cmu/idgah_117.wav,573636,let us look at the plot of this story exposition it is the day of eid and everybody is excited hamid is the most excited of all however they are poor and cannot even afford to make the pudding
/home/testuser/git-lfs-2.2.0/deepspeech/data/cmu/idgah_118.wav,255152,conflict all hamid has is three pice how should he spend it
/home/testuser/git-lfs-2.2.0/deepspeech/data/cmu/idgah_119.wav,478342,rising action hamid is tempted by the array of stalls in the fair and taunted by his friends most importantly he still doesnt know what he should buy
/home/testuser/git-lfs-2.2.0/deepspeech/data/cmu/idgah_11.wav,170724,before we start reading the story lets have our first activity
/home/testuser/git-lfs-2.2.0/deepspeech/data/cmu/idgah_120.wav,571964,climax hamid takes one look at a pair of tongs and knows its the perfect way to spend his money he buys the tongs for his grandma his friends make fun of them but he beats them with clever arguments
/home/testuser/git-lfs-2.2.0/deepspeech/data/cmu/idgah_121.wav,285244,falling action soon the tables turn and his friends start vying for the hamids tongs
/home/testuser/git-lfs-2.2.0/deepspeech/data/cmu/idgah_122.wav,486700,resolution hamid presents the gifts to his grandma who is overjoyed with him hamids decision to buy the tongs pays off click next to continue
/home/testuser/git-lfs-2.2.0/deepspeech/data/cmu/idgah_123.wav,772584,point of view refers to the way the story is narrated broadly speaking there are three types of points of views the first person point of view is when the story is narrated by a character from the story it can be easily identified by the use of the pronouns i me and myself
/home/testuser/git-lfs-2.2.0/deepspeech/data/cmu/idgah_124.wav,649704,this story is narrated in the third person as the narrator is not a part of the story moreover he is omniscient or in other words he can see everything and knows the feelings of every character click next to continue
/home/testuser/git-lfs-2.2.0/deepspeech/data/cmu/idgah_125.wav,905496,next element is the conflict however this is not the same as the one we discussed along with plot this conflict pertains more to the character than to the plot the conflict can either be internal or external an internal conflict refers to a conflict in the mind of the character it is a persons conflict with himself
/home/testuser/git-lfs-2.2.0/deepspeech/data/cmu/idgah_126.wav,765898,in this story the main conflict is in the mind of hamid the fair is full of temptations and all he has is only three pice moreover all his friends have more money than him he struggles to decide what would be the right way of spending the money click next to continue
/home/testuser/git-lfs-2.2.0/deepspeech/data/cmu/idgah_127.wav,250136,the theme is the main idea of the story it includes the message or the moral of the story
/home/testuser/git-lfs-2.2.0/deepspeech/data/cmu/idgah_128.wav,712398,this story is about the joy of giving it is about selflessness and empathy hamid doesnt hesitate before spending the money on a gift for his grandma he knows this is the best way of spending the money because he knows how his grandma suffers without the tongs
/home/testuser/git-lfs-2.2.0/deepspeech/data/cmu/idgah_12.wav,947292,imagine you have been given some money to buy the items mentioned below but the money is not enough to buy all of these rate the items in the order of importance so that you can buy the four most important things mention the reason for your choice you can choose to add new items or leave some out of the list click next once you are done
/home/testuser/git-lfs-2.2.0/deepspeech/data/cmu/idgah_13.wav,430694,did you rate the items share your ratings with the class also discuss your reasons behind the ratings click next after the discussion
/home/testuser/git-lfs-2.2.0/deepspeech/data/cmu/idgah_14.wav,291096,let us take a look at the title of the story isnt eid the name of a festival well yes
/home/testuser/git-lfs-2.2.0/deepspeech/data/cmu/idgah_15.wav,681470,the word id symbolizes a muslim festival there are two eids celebrated worldwide firstly there is eid ul fitr it is an important festival for the muslims as it marks the end of ramadan the islamic holy month of fasting
/home/testuser/git-lfs-2.2.0/deepspeech/data/cmu/idgah_16.wav,556082,now we do know about two important festivals of india but what does the word gah mean discuss and try to guess the answer click lets check tab to check your response
/home/testuser/git-lfs-2.2.0/deepspeech/data/cmu/idgah_17.wav,467474,the word gah refers to a place idgah is an urdu term used for an open air space usually outside the city to perform id prayers
/home/testuser/git-lfs-2.2.0/deepspeech/data/cmu/idgah_18.wav,196636,now look at the title idgah what do you think the story is about
/home/testuser/git-lfs-2.2.0/deepspeech/data/cmu/idgah_19.wav,672274,think pair and then share your predictions you have two minutes to think one minute to pair up and discuss with your partner and then your teacher will hold a two minutes discussion in the class click lets check tab to check your response
/home/testuser/git-lfs-2.2.0/deepspeech/data/cmu/idgah_20.wav,286080,the story is about a young boy and the challenge he faces as his friends enjoy a fair but he cannot
/home/testuser/git-lfs-2.2.0/deepspeech/data/cmu/idgah_22.wav,561934,a full thirty days after ramadan comes eid how wonderful and beautiful is the morning of eid the trees look greener the field more festive the sky has a lovely pink glow
/home/testuser/git-lfs-2.2.0/deepspeech/data/cmu/idgah_23.wav,803514,the boys are more excited than the others some of them kept only one fast and that only till noon some didnt even do that but no one can deny them the joy of going to the eidgah fasting is for the grown ups and the aged for the boys it is only the day of eid
/home/testuser/git-lfs-2.2.0/deepspeech/data/cmu/idgah_24.wav,520974,the entire village is excited about the idea of celebrating eid the usual chores work and worries have been given place to an ambience of merrymaking joyfulness and pleasure
/home/testuser/git-lfs-2.2.0/deepspeech/data/cmu/idgah_25.wav,210848,look at these words and phrases what extra information do they give
/home/testuser/git-lfs-2.2.0/deepspeech/data/cmu/idgah_26.wav,609580,these words signify degree of comparison we all know adjectives express the quality/attribute of the noun these are of three kinds they are positive comparative and superlative
/home/testuser/git-lfs-2.2.0/deepspeech/data/cmu/idgah_27.wav,594534,the words which have more than two vowel sounds take the word more before them in comparative form and the word the most in superlative form click next to continue
/home/testuser/git-lfs-2.2.0/deepspeech/data/cmu/idgah_29.wav,429022,now that we know what those highlighted words are can you guess why the author has used so many comparatives click next to continue
/home/testuser/git-lfs-2.2.0/deepspeech/data/cmu/idgah_2.wav,785120,i wonder if my drawing will be as good as theirs i wonder if they will like me or just be full of stares i wonder if my teacher will look like mom or gran i wonder if my puppy will wonder where i am
/home/testuser/git-lfs-2.2.0/deepspeech/data/cmu/idgah_30.wav,444904,the author uses degrees of comparison to emphasize certain objects persons places or events which have unique or extraordinary attributes
/home/testuser/git-lfs-2.2.0/deepspeech/data/cmu/idgah_32.wav,883762,they are forever taking the treasure out of their pockets counting and recounting it before putting it back mahmood counts one two ten twelve he has twelve pice mohsin has one two three eight nine fifteen pice
/home/testuser/git-lfs-2.2.0/deepspeech/data/cmu/idgah_33.wav,472490,this makes hamid very happy it is great to live on hope for a child there is nothing like hope a childs imagination can turn a mustard seed into a mountain
/home/testuser/git-lfs-2.2.0/deepspeech/data/cmu/idgah_35.wav,592026,well it is strange hamid had just a few coins and yet the author portrays him as the happiest child can you pinpoint the reasons that the authors gives click next to continue
/home/testuser/git-lfs-2.2.0/deepspeech/data/cmu/idgah_36.wav,913854,the author talks about the innocence of a child hamid is a penniless child who is full of excitement he awaits the miracles that are supposed to happen in his life hope makes him look brightly towards the future his clothes are tattered with dirt and but he awaits the day when all his wishes will come true click next to continue
/home/testuser/git-lfs-2.2.0/deepspeech/data/cmu/idgah_37.wav,690664,time for another activity we have read that the boys are more excited about going to idgah than the grown ups how are the preparations of the grown ups different from those of the boys discuss click next to continue
/home/testuser/git-lfs-2.2.0/deepspeech/data/cmu/idgah_38.wav,712398,here are the differences the grownups have fasted for the entire month of ramadan boys on the other hand fasted for one or two days the grown ups are bothered about completing the chores before going to the mosque boys on the other hand are busy counting the money they have
/home/testuser/git-lfs-2.2.0/deepspeech/data/cmu/idgah_40.wav,916362,in her hovel the unfortunate ameena sheds bitter tears it is eid and she does not have even a handful of grain only if her abid were there it would have been a different kind of eid hamid goes to his grandmother and says granny dont you fret over me i will be the first to get back dont worry ameena is sad other boys are going out with their fathers she is the only father hamid has how can she let him go to the fair all by himself what if he gets lost in the crowd no she must not lose her precious little soul how can he walk three miles he doesnt even have a pair of shoes he will get blisters on his feet if she went along with him she could pick him up now and then but then who would be there to cook the vermicelli click next to continue
/home/testuser/git-lfs-2.2.0/deepspeech/data/cmu/idgah_41.wav,554410,if only she had the money she could have bought the ingredients on the way back and quickly made the pudding in the village it would take her many hours to get everything the only way out was to ask someone for them the villagers leave in one party with the boys is hamid they run on ahead of the elders and wait for them under a tree why do the oldies drag their feet and hamid is like one with wings on his feet how could anyone think he would get tired click next to continue
/home/testuser/git-lfs-2.2.0/deepspeech/data/cmu/idgah_42.wav,176574,look at the line she is the only father hamid has
/home/testuser/git-lfs-2.2.0/deepspeech/data/cmu/idgah_43.wav,566948,now lets pause for a moment we know ameena is hamids granny so why does the author refer to ameena as hamids only father click lets check tab to check your responses
/home/testuser/git-lfs-2.2.0/deepspeech/data/cmu/idgah_44.wav,530168,as we all know that hamid is an orphan who has lost his parents therefore ameena is the sole guardian of hamid the word father here stands for the father figure or the guardian
/home/testuser/git-lfs-2.2.0/deepspeech/data/cmu/idgah_45.wav,363820,such phrases are called metaphors do you remember what a metaphor is click explore to know more about metaphors
/home/testuser/git-lfs-2.2.0/deepspeech/data/cmu/idgah_46.wav,250972,a metaphor is a figure of speech that refers to one entity by mentioning another entity
/home/testuser/git-lfs-2.2.0/deepspeech/data/cmu/idgah_47.wav,421498,let us look at an example rajesh is a walking encyclopedia an encyclopedia is a book which has a comprehensive information about a branch of knowledge
/home/testuser/git-lfs-2.2.0/deepspeech/data/cmu/idgah_48.wav,285244,rajesh is such a clever and an intelligent boy that his knowledge is being compared to that of an encyclopedia
/home/testuser/git-lfs-2.2.0/deepspeech/data/cmu/idgah_4.wav,764222,this story is written by one of the most prominent writers of the twentieth century munshi premchand does the name sound familiar for those of you who havent heard of him before here is a brief introduction to one of the pioneers of hindi literature click next to continue
/home/testuser/git-lfs-2.2.0/deepspeech/data/cmu/idgah_50.wav,360476,look at this line from the story and hamid is like one with wings on his feet click next to continue
/home/testuser/git-lfs-2.2.0/deepspeech/data/cmu/idgah_51.wav,484192,time for another activity read the question and select the correct option why do you think hamid is like one with wings on his feet click next to continue
/home/testuser/git-lfs-2.2.0/deepspeech/data/cmu/idgah_52.wav,427350,hamid is like one with wings on his feet because he is very excited and happy to go to the eidgah the use of like makes this a simile
/home/testuser/git-lfs-2.2.0/deepspeech/data/cmu/idgah_53.wav,230074,now look at these lines why do you think hamid is so excited about going to the eidgah
/home/testuser/git-lfs-2.2.0/deepspeech/data/cmu/idgah_54.wav,669766,hamid along with the entire village is agog with excitement due to the festival of eid the children especially will get the opportunity to visit the fair where they will get to eat various sweets and can buy toys too click next to continue
/home/testuser/git-lfs-2.2.0/deepspeech/data/cmu/idgah_56.wav,818560,they reach the suburbs of the town it begins to get crowded parties heading for the eidgah are coming into town from different sides each one dressed better than the other some on tongas and ekkas some in motorcars all wearing perfume all bursting with excitement
/home/testuser/git-lfs-2.2.0/deepspeech/data/cmu/idgah_57.wav,602058,above it are massive tamarind trees casting their shade on the cemented floor on which carpets have been spread and there are row upon row of worshippers as far as the eye can see spilling well beyond the mosque courtyard
/home/testuser/git-lfs-2.2.0/deepspeech/data/cmu/idgah_58.wav,822740,and then all together they stand erect bow down and sit on their knees many times they repeat these movements exactly as if a hundred thousand electric bulbs were switched on and off at the same time again and again what a wonderful spectacle it is click next to continue
/home/testuser/git-lfs-2.2.0/deepspeech/data/cmu/idgah_59.wav,178246,time for another activity look at the highlighted line
/home/testuser/git-lfs-2.2.0/deepspeech/data/cmu/idgah_5.wav,401432,premchand was born in a village called lamhi in the north western provinces of british india it is located near the holy city of varanasi
/home/testuser/git-lfs-2.2.0/deepspeech/data/cmu/idgah_60.wav,371344,why do you think the villagers gape at the objects as they reach the town discuss with your classmates click next to continue
/home/testuser/git-lfs-2.2.0/deepspeech/data/cmu/idgah_61.wav,678962,a village life is distinguished for its simplicity which is a stark contrast of a town or a city the villagers are simple people they notice several unfamiliar scenarios which they do not get to see in their rural surroundings click next to continue
/home/testuser/git-lfs-2.2.0/deepspeech/data/cmu/idgah_63.wav,254316,why do you think the writer talks about the equality of rich and poor click next to continue
/home/testuser/git-lfs-2.2.0/deepspeech/data/cmu/idgah_64.wav,907168,when people come to the idgah to pray they are equal in front of the god the rich and poor are same in front of the almighty that is whoever came to the idgah first takes his place in the front row despite his financial states or position and whoever come late occupies the last rows click next to continue
/home/testuser/git-lfs-2.2.0/deepspeech/data/cmu/idgah_66.wav,863700,the prayer is over men embrace each other they descend on the sweet and toy vendors stores like an army moving to an assault in this matter the grown up rustic is no less eager than the boys look here is a swing pay a pice and enjoy riding up to the heavens and then plummeting down to the earth
/home/testuser/git-lfs-2.2.0/deepspeech/data/cmu/idgah_67.wav,730788,there is a row of stalls on one side with all kinds of toys soldiers and milkmaids kings and ministers water carriers and washerwomen and holy men splendid display how lifelike all they need are tongues to speak
/home/testuser/git-lfs-2.2.0/deepspeech/data/cmu/idgah_69.wav,799334,read the given lines and answer the question hamid watches them from a distance all he has are three pice he couldnt afford to part with a third of his treasure for a few miserable rounds why do you think hamid finds the rides miserable click lets check tab to check your responses
/home/testuser/git-lfs-2.2.0/deepspeech/data/cmu/idgah_6.wav,442392,he belonged to a large well to do family his father ajaib rai was a clerk in the post office his mother anandi devi was a housewife
/home/testuser/git-lfs-2.2.0/deepspeech/data/cmu/idgah_70.wav,361312,he has just three pice in his pocket he is looking for something which is worthy enough for him to spend his precious three pice on
/home/testuser/git-lfs-2.2.0/deepspeech/data/cmu/idgah_71.wav,619612,the author gives a lively description of a village fair where the children are busy in merrymaking after the prayer get over they rush towards the sweet shops and the toy vendors shop they are thrilled by the sight of numerous rides
/home/testuser/git-lfs-2.2.0/deepspeech/data/cmu/idgah_73.wav,296948,drag and drop the words to fill in the blanks click next to continue once you are done with the activity
/home/testuser/git-lfs-2.2.0/deepspeech/data/cmu/idgah_74.wav,504254,discuss the questions to predict what happened next how do you think hamid will spend his three pice will he spend them for sweets and toys will he buy nothing at all
/home/testuser/git-lfs-2.2.0/deepspeech/data/cmu/idgah_75.wav,164872,well let us read further to know what happened next
/home/testuser/git-lfs-2.2.0/deepspeech/data/cmu/idgah_76.wav,640510,these toys cost two pice each all hamid has are three pice how can he afford to buy such expensive toys if they dropped out of his hand they would be smashed to bits if a drop of water fell on them the paint would run
/home/testuser/git-lfs-2.2.0/deepspeech/data/cmu/idgah_77.wav,781780,hamid stretches out his hand mohsin puts the candy in his own mouth mahmood noorey and sammi clap their hands with glee and have a jolly good laugh hamid is crestfallen after the sweet vendors there are a few hardware stores and shops of real and artificial jewellery
/home/testuser/git-lfs-2.2.0/deepspeech/data/cmu/idgah_78.wav,165708,its time for another activity look at this line
/home/testuser/git-lfs-2.2.0/deepspeech/data/cmu/idgah_79.wav,226730,what do these lines reveal about hamid click lets check to know the answer
/home/testuser/git-lfs-2.2.0/deepspeech/data/cmu/idgah_7.wav,822736,premchand is considered the first hindi author whose writings prominently featured realism his novels describe the problems of the poor and the urban middle class his works depict a rationalistic outlook which views religious values as something that allows the powerful hypocrites to exploit the weak
/home/testuser/git-lfs-2.2.0/deepspeech/data/cmu/idgah_80.wav,701532,these lines reveal the maturity of a four year old hamid who places his grandmothers unsaid need before his own desires this maturity and wisdom of hamid distinguishes him from the rest of the kids in the story click next to proceed
/home/testuser/git-lfs-2.2.0/deepspeech/data/cmu/idgah_81.wav,424006,how do you think hamids friends would react to him buying a tong of all things predict your answer let us read further to find out the reaction of his friends
/home/testuser/git-lfs-2.2.0/deepspeech/data/cmu/idgah_83.wav,597042,mohsin laughs and says are you crazy what will you do with the tongs hamid flings the tongs on the ground and replies try and throw your water carrier on the ground every bone in his body will break
/home/testuser/git-lfs-2.2.0/deepspeech/data/cmu/idgah_84.wav,928902,sammi who had bought a small tambourine asks will you exchange them for my tambourine it is worth eight pice hamid pretends not to look at the tambourine my tongs if they wanted to could tear out the bowels of your tambourine all it has is a leather skin and all it can say is dhub dhub a drop of water could silence it forever
/home/testuser/git-lfs-2.2.0/deepspeech/data/cmu/idgah_85.wav,954814,mohsin thinks of another ploy your tongs face will burn in the fire every day he is sure that this will leave hamid speechless that is not so pat comes hamid with the retort mister it is only the brave who can jump into a fire your miserable lawyers policemen and water carriers will run like frightened women into their homes
/home/testuser/git-lfs-2.2.0/deepspeech/data/cmu/idgah_86.wav,913854,it does not make sense but our three heroes are utterly squashed almost as if a champion kite had been brought down from the heavens to the earth by a cheap miserable paper imitation thus hamid wins the field his tongs are the champion of india neither mohsin nor mahmood neither noorey nor sammi nor anyone else can dispute the fact
/home/testuser/git-lfs-2.2.0/deepspeech/data/cmu/idgah_88.wav,310322,why do you think hamid pretends not to look at the tambourine click lets check tab to check your responses
/home/testuser/git-lfs-2.2.0/deepspeech/data/cmu/idgah_89.wav,561934,hamid doesnt want to be subdued by the expensive toys which his friends bought he holds his pair of tongs proudly and is completely indifferent to the more expensive toys the others bought click next to continue
