wav_filename,wav_filesize,transcript
/home/testuser/git-lfs-2.2.0/deepspeech/data/cmu/desireesbaby_45.wav,467528,how do the lines describe the change in attitude and reaction of the characters after the baby was born share your thoughts in the class click lets check to check your predictions
/home/testuser/git-lfs-2.2.0/deepspeech/data/cmu/desireesbaby_46.wav,957376,desiree remarks about how much the baby has grown it is apparent that she does not see anything wrong with her son she is very happy as ever since the baby was born her husband armand who normally is very strict and harsh has become quite amiable and light hearted madame valmonde on the other hand has noticed the difference in the baby and is alarmed
/home/testuser/git-lfs-2.2.0/deepspeech/data/cmu/desireesbaby_48.wav,505980,read the lines desiree even mentions that armand has not punished one of them who is she referring to as them click the lets check tab to check your observation
/home/testuser/git-lfs-2.2.0/deepspeech/data/cmu/desireesbaby_49.wav,444122,well you are correct she use plural pronoun them for the african american slaves which were employed at armands house click next to continue
/home/testuser/git-lfs-2.2.0/deepspeech/data/cmu/desireesbaby_50.wav,930628,what desiree said was true marriage and later the birth of his son had softened armand aubignys imperious and exacting nature greatly this was what made the gentle desiree so happy for she loved him desperately when he frowned she trembled but loved him when he smiled she asked no greater blessing of god
/home/testuser/git-lfs-2.2.0/deepspeech/data/cmu/desireesbaby_52.wav,426568,look at the highlighted lines what does this tell you about the personality traits of desiree and armand click the lets check tab to check your observation
/home/testuser/git-lfs-2.2.0/deepspeech/data/cmu/desireesbaby_53.wav,722484,desiree is a tender hearted person who shows compassion for everyone armande on the other hand behaves in an ill mannered way with the slaves desiree basks in the glow of her husbands love armande on the other hand feels that desiree is subservient to him
/home/testuser/git-lfs-2.2.0/deepspeech/data/cmu/desireesbaby_55.wav,847036,she sat in her room one hot afternoon in her peignoir listlessly drawing through her fingers the strands of her long silky brown hair that hung about her shoulders the baby half naked lay asleep upon her own great mahogany bed that was like a sumptuous throne with its satin lined half canopy
/home/testuser/git-lfs-2.2.0/deepspeech/data/cmu/desireesbaby_57.wav,195018,look at the highlighted phrase which literary device is being used here
/home/testuser/git-lfs-2.2.0/deepspeech/data/cmu/desireesbaby_58.wav,500130,great mahogany bed that was like a sumptuous throne is an example of metaphor smile and irony click the lets check tab to check your observation
/home/testuser/git-lfs-2.2.0/deepspeech/data/cmu/desireesbaby_59.wav,290314,well done it is an instance of a simile the enormous bed has been compared to a throne
/home/testuser/git-lfs-2.2.0/deepspeech/data/cmu/desireesbaby_5.wav,169940,before going into the chapter let us find out some more about the author
/home/testuser/git-lfs-2.2.0/deepspeech/data/cmu/desireesbaby_60.wav,435764,now read the passage again and find any other instance/s of a simile highlight the same click the lets check tab to check your observation
/home/testuser/git-lfs-2.2.0/deepspeech/data/cmu/desireesbaby_61.wav,350500,blood turned like ice is another instance of a simile desiree was stupefied by an observation which benumbed her
/home/testuser/git-lfs-2.2.0/deepspeech/data/cmu/desireesbaby_63.wav,185824,look at the highlighted phrase which literary device is used here
/home/testuser/git-lfs-2.2.0/deepspeech/data/cmu/desireesbaby_64.wav,368890,is threatening mist an instance of personification metaphor or smiley click the lets check tab to check your observation
/home/testuser/git-lfs-2.2.0/deepspeech/data/cmu/desireesbaby_66.wav,683196,the phrase threatening mist is used to refer to the nerve racking situation of desiree she was restless due to a sudden change in behaviour of armand she could sense that something was not alright but couldnt pinpoint as to exactly what was awry
/home/testuser/git-lfs-2.2.0/deepspeech/data/cmu/desireesbaby_68.wav,339632,how did desiree realize the reason of change in the attitude of armand click the lets check tab to check your observation
/home/testuser/git-lfs-2.2.0/deepspeech/data/cmu/desireesbaby_69.wav,452482,desiree compares the skin tone of the quadroon boy to her sons and notices that notices that they are similar thus she realizes that her son is a black baby
/home/testuser/git-lfs-2.2.0/deepspeech/data/cmu/desireesbaby_6.wav,372232,kate chopin was born as catherine o flaherty on 8 february 1850 in st louis missouri in the united states
/home/testuser/git-lfs-2.2.0/deepspeech/data/cmu/desireesbaby_70.wav,240994,do you think armand hated his wife and son for the same reason note down your predictions
/home/testuser/git-lfs-2.2.0/deepspeech/data/cmu/desireesbaby_72.wav,851214,presently her husband entered the room and without noticing her went to a table and began to search among some papers which covered it armand she called to him in a voice which must have stabbed him if he was human but he did not notice armand she said again then she rose and tottered towards him
/home/testuser/git-lfs-2.2.0/deepspeech/data/cmu/desireesbaby_74.wav,405670,do you think the way armand treated desiree was fair what does this tell us about the contemporary society click the lets check tab to check your observation
/home/testuser/git-lfs-2.2.0/deepspeech/data/cmu/desireesbaby_75.wav,582050,armand typical of his class arrogantly shuns his wife who before the birth of the baby he had adored like many american men of the nineteenth century south armand finds the worth of a person based on her race
/home/testuser/git-lfs-2.2.0/deepspeech/data/cmu/desireesbaby_76.wav,699914,read the lines initially when monsieur valmonde had informed aubigny about desirees obscure background it was a trivial matter and aubigny brushed it aside why do you think it becomes a matter of greater importance now click the lets check tab to check your observation
/home/testuser/git-lfs-2.2.0/deepspeech/data/cmu/desireesbaby_77.wav,929792,armande was young and did not care about the world when he had fallen in love with desiree but after the birth of his son his true nature is revealed in front of desiree when he notices that his son is born with a darker skin tone he immediately concludes that his son has inherited these features from desiree thus proclaiming her to belong to the race of the slaves
/home/testuser/git-lfs-2.2.0/deepspeech/data/cmu/desireesbaby_78.wav,246010,how do you think madame valmonde would have replied to desirees letter let us read further to find out
/home/testuser/git-lfs-2.2.0/deepspeech/data/cmu/desireesbaby_7.wav,606288,her father was a successful businessman and her mother was a well connected member of the french community after her fathers death she grew up in a household dominated by women her mother great grandmother and the female slaves
/home/testuser/git-lfs-2.2.0/deepspeech/data/cmu/desireesbaby_80.wav,906386,the answer that came was brief my own desiree come home to valmonde back to your mother who loves you come with your child when the letter reached desiree she went with it to her husbands study and laid it open upon the desk before which he sat she was like a stone image silent white motionless after she placed it there
/home/testuser/git-lfs-2.2.0/deepspeech/data/cmu/desireesbaby_82.wav,367218,read the highlighted lines list down the inferences you get from madame valmondes reply click the lets check tab to check your observation
/home/testuser/git-lfs-2.2.0/deepspeech/data/cmu/desireesbaby_83.wav,473380,well done she exhibits true maternal feelings towards desiree and her baby the obscure origin of desiree does not bother her though she has her own doubts about it
/home/testuser/git-lfs-2.2.0/deepspeech/data/cmu/desireesbaby_84.wav,866262,desiree went in search of her child zandrine was pacing the sombre gallery with it she took the little one from the nurses arms with no word of explanation and descending the steps walked away under the live oak branches it was an october afternoon the sun was just sinking out in the still fields the negroes were picking cotton
/home/testuser/git-lfs-2.2.0/deepspeech/data/cmu/desireesbaby_86.wav,383936,look at the highlighted lines why didnt desiree take the road which could have taken her to the house of valmondes click the lets check tab to check your observation
/home/testuser/git-lfs-2.2.0/deepspeech/data/cmu/desireesbaby_88.wav,802732,desiree was categorized as a non white which meant she belonged to the race of the slaves in this way her social standing was severely diminished aubigny had abandoned her and her son even moving into her mothers home would not have given her a life she and her son would have lived in isolation with no prospects for a happy future
/home/testuser/git-lfs-2.2.0/deepspeech/data/cmu/desireesbaby_89.wav,780162,some weeks later there was a curious scene enacted at labri in the centre of the smoothly swept back yard was a great bonfire armand aubigny sat in the wide hallway that commanded a view of the spectacle and it was he who dealt out to a half dozen negroes the material which kept this fire ablaze
/home/testuser/git-lfs-2.2.0/deepspeech/data/cmu/desireesbaby_8.wav,735020,chopins books deal with issues of identity and morality her writing style is influenced by her irish and french lineage the themes of her works are based on struggles of womanhood through her stories kate chopin wrote her autobiography and documented her surroundings
/home/testuser/git-lfs-2.2.0/deepspeech/data/cmu/desireesbaby_91.wav,718304,read the lines and then answer the given question there was the remnant of one back in the drawer from which he took them but it was not desirees it was part of an old letter from his mother to his father he read it she was thanking god for the blessing of her husbands love
/home/testuser/git-lfs-2.2.0/deepspeech/data/cmu/desireesbaby_92.wav,317064,we will now look at each element of the story individually remember that not all stories will have each of the elements 
/home/testuser/git-lfs-2.2.0/deepspeech/data/cmu/desireesbaby_93.wav,702422,first we will look at the setting there are two aspects to consider under setting the location of the story and the time and date when the story takes place the story is set in louisiana united states of america the time period is mid nineteenth century during the era of slavery
/home/testuser/git-lfs-2.2.0/deepspeech/data/cmu/desireesbaby_95.wav,932298,stories must have at least one character most stories usually have a protagonist and an antagonist the protagonist is the main character of the story whereas antagonist is the person opposing the protagonist the antagonist is usually a negative character a story might not have an antagonist then there are the secondary characters
/home/testuser/git-lfs-2.2.0/deepspeech/data/cmu/desireesbaby_97.wav,902206,next we will look at the plot plot is the structure of a story it refers to the events that make up the story the initial event is the exposition or the way the story is introduced to the reader soon after the exposition the central problem of the story is presented this is the conflict in the plot an event that takes the plot of the story forward
/home/testuser/git-lfs-2.2.0/deepspeech/data/cmu/desireesbaby_99.wav,959884,point of view refers to the way the story is narrated broadly speaking there are three types of points of views the first person point of view is when the story is narrated by a character from the story it can be easily identified by the use of the pronouns i me and myself usually its the protagonist of the story who narrates the story but secondary characters might also be the narrator
/home/testuser/git-lfs-2.2.0/deepspeech/data/cmu/desireesbaby_9.wav,378920,kates major works were two short story collections named bayou folk 1894 and a night in acadie 1897
/home/testuser/git-lfs-2.2.0/deepspeech/data/cmu/diffusion_osmosis_10.wav,275062,to begin with diffusion can occur in all types of media such as liquids and gases
/home/testuser/git-lfs-2.2.0/deepspeech/data/cmu/diffusion_osmosis_11.wav,908688,for instance diffusion of liquid in liquid medium occurs when ink is dropped into water diffusion of solid in liquid medium is seen in the case of sugar cube and water diffusion of liquid in gas medium is seen when perfume is sprayed in the air and diffusion of solid in gas medium is seen when dust particles disperse in air
/home/testuser/git-lfs-2.2.0/deepspeech/data/cmu/diffusion_osmosis_12.wav,265030,on the other hand as seen with the dialysis tubing osmosis occurs only in a liquid medium
/home/testuser/git-lfs-2.2.0/deepspeech/data/cmu/diffusion_osmosis_13.wav,479862,diffusion involves the direct movement of molecules across different media without the requirement of any membrane while osmosis occurs only through a semipermeable membrane
/home/testuser/git-lfs-2.2.0/deepspeech/data/cmu/diffusion_osmosis_14.wav,289272,with respect to the pace of the processes diffusion is rapid in gases and slow in the case of liquids
/home/testuser/git-lfs-2.2.0/deepspeech/data/cmu/diffusion_osmosis_15.wav,173080,while osmosis in general is a very slow process
/home/testuser/git-lfs-2.2.0/deepspeech/data/cmu/diffusion_osmosis_16.wav,514970,as far as energy is concerned diffusion does not involve any energy expenditure while osmosis requires energy to push the solvent molecules across the semipermeable membrane
/home/testuser/git-lfs-2.2.0/deepspeech/data/cmu/diffusion_osmosis_17.wav,468994,lastly in terms of the distance travelled by the molecules it is observed that in diffusion gas liquid or solid molecules diffuse over long distances
/home/testuser/git-lfs-2.2.0/deepspeech/data/cmu/diffusion_osmosis_18.wav,283420,on the other hand the molecules moving through osmosis are transported only up to a short distance
/home/testuser/git-lfs-2.2.0/deepspeech/data/cmu/diffusion_osmosis_19.wav,231594,thus we have looked into the differences between the processes of diffusion and osmosis
/home/testuser/git-lfs-2.2.0/deepspeech/data/cmu/diffusion_osmosis_2.wav,248312,in this module you will learn about the differences between diffusion and osmosis
/home/testuser/git-lfs-2.2.0/deepspeech/data/cmu/diffusion_osmosis_3.wav,352802,what happens if you add a pinch of food colour into a beaker containing water the food colour spreads through water and imparts its colour to the water
/home/testuser/git-lfs-2.2.0/deepspeech/data/cmu/diffusion_osmosis_4.wav,574320,now take a dialysis tubing seal it at one end fill it with water and add food colour to the water then seal the other end of the dialysis tube also and drop it into a beaker containing water
/home/testuser/git-lfs-2.2.0/deepspeech/data/cmu/diffusion_osmosis_5.wav,163884,you will observe that the dialysis tubing bulges in size
/home/testuser/git-lfs-2.2.0/deepspeech/data/cmu/diffusion_osmosis_6.wav,389582,so what do these two activities indicate both of them involve the movement of some molecules but what is the difference between the two phenomena
/home/testuser/git-lfs-2.2.0/deepspeech/data/cmu/diffusion_osmosis_7.wav,579336,in the first case there is movement of solute molecules that is food colour from a region of higher concentration to a region of lower concentration this process is called diffusion
/home/testuser/git-lfs-2.2.0/deepspeech/data/cmu/diffusion_osmosis_8.wav,883610,in the second case there is movement of solvent molecules that is water from a region of higher concentration to a region of lower concentration of solvent or from a region of lower concentration to a region of higher concentration of solute through a semipermeable membrane this process is called osmosis
/home/testuser/git-lfs-2.2.0/deepspeech/data/cmu/diffusion_osmosis_9.wav,758222,now let us further see how both diffusion and osmosis vary from each other in terms of the media they occur in the role of the semipermeable membrane if any the pace of the process requirement of energy and the distance travelled by the molecules
/home/testuser/git-lfs-2.2.0/deepspeech/data/cmu/earthworm_10.wav,285928,towards the anterior end the first segment bears the mouth which opens into the buccal cavity up to the third segment
/home/testuser/git-lfs-2.2.0/deepspeech/data/cmu/earthworm_11.wav,270046,the buccal cavity is followed by a muscular pharynx which continues into a narrow oesophagus between the fifth and seventh segments
/home/testuser/git-lfs-2.2.0/deepspeech/data/cmu/earthworm_12.wav,246640,the gizzard located in the eighth and ninth segments helps grind soil particles and organic matter
/home/testuser/git-lfs-2.2.0/deepspeech/data/cmu/earthworm_13.wav,234102,this organic matter is mixed with soil and is digested in the stomach that lies between the ninth and fourteenth segments
/home/testuser/git-lfs-2.2.0/deepspeech/data/cmu/earthworm_14.wav,262522,the stomach also has calciferous glands which neutralise the humic acid present in the partially decomposed organic matter
/home/testuser/git-lfs-2.2.0/deepspeech/data/cmu/earthworm_15.wav,228250,the stomach continues into a long intestine which starts from the fifteenth segment and continues till the last segment
/home/testuser/git-lfs-2.2.0/deepspeech/data/cmu/earthworm_16.wav,227414,a pair of short conical projections of intestinal caecae is present on the twenty sixth segment
/home/testuser/git-lfs-2.2.0/deepspeech/data/cmu/earthworm_17.wav,409644,the intestine shows internal folds called typhlosole between the twenty sixth and the thirty fifth segments which also increases the surface area for better absorption of digested nutrients
/home/testuser/git-lfs-2.2.0/deepspeech/data/cmu/earthworm_18.wav,285092,finally in the last segment the alimentary canal opens to the exterior through a small aperture called the anus
/home/testuser/git-lfs-2.2.0/deepspeech/data/cmu/earthworm_19.wav,500760,as the ingested matter passes through the alimentary canal it is broken down into simpler absorbable molecules by digestive enzymes these molecules are then absorbed through intestinal membranes and are utilised by the earthworm
/home/testuser/git-lfs-2.2.0/deepspeech/data/cmu/earthworm_21.wav,168900,this system consists of blood vessels capillaries and hearts
/home/testuser/git-lfs-2.2.0/deepspeech/data/cmu/earthworm_22.wav,182274,small blood vessels supply blood to the gut nerve cord and body wall
/home/testuser/git-lfs-2.2.0/deepspeech/data/cmu/earthworm_23.wav,302646,earthworms also have blood glands between the fourth and sixth segments that produce blood cells and haemoglobin which are dissolved in the blood plasma
/home/testuser/git-lfs-2.2.0/deepspeech/data/cmu/earthworm_25.wav,249148,moreover the hearts which are important organs in the circulatory system help circulate blood in one direction
/home/testuser/git-lfs-2.2.0/deepspeech/data/cmu/earthworm_28.wav,221562,there are three types of nephridia namely septal integumentary and pharyngeal
/home/testuser/git-lfs-2.2.0/deepspeech/data/cmu/earthworm_29.wav,311842,the septal nephridia are present on either side of the intersegmental septa between the fifteenth segment and the last segment and open into the intestine
/home/testuser/git-lfs-2.2.0/deepspeech/data/cmu/earthworm_30.wav,289272,the integumentary nephridia are attached to the lining of the body wall from the third segment to the last segment and open on to the body surface
/home/testuser/git-lfs-2.2.0/deepspeech/data/cmu/earthworm_31.wav,261686,the pharyngeal nephridia occur as paired tufts on either side of the pharynx and oesophagus from the fourth to the sixth segments
/home/testuser/git-lfs-2.2.0/deepspeech/data/cmu/earthworm_32.wav,231594,all three types of nephridia have similar structures and regulate the volume and composition of body fluids
/home/testuser/git-lfs-2.2.0/deepspeech/data/cmu/earthworm_33.wav,448096,each nephridium has a funnel that collects excess coelomic fluid this funnel links to a tubular part of the nephridium from where waste is discharged through nephridiopores
/home/testuser/git-lfs-2.2.0/deepspeech/data/cmu/earthworm_36.wav,370356,at the anterior end in the third and fourth segments the nerve cord bifurcates encircles the pharynx and joins the cerebral ganglia to form a nerve ring
/home/testuser/git-lfs-2.2.0/deepspeech/data/cmu/earthworm_37.wav,304318,the cerebral ganglia along with other nerves in the ring integrate sensory input as well as control the muscular responses of the body
/home/testuser/git-lfs-2.2.0/deepspeech/data/cmu/earthworm_38.wav,390418,did you know that earthworms dont possess eyes however they have light and touch sensitive receptors to help them recognise light intensities and ground vibrations
/home/testuser/git-lfs-2.2.0/deepspeech/data/cmu/earthworm_39.wav,380386,besides they also have specialised chemoreceptors or taste receptors which help them respond to any chemical stimuli and are situated at the anterior end
/home/testuser/git-lfs-2.2.0/deepspeech/data/cmu/earthworm_3.wav,193978,our planet is home to thousands of animals that exhibit morphological similarities and differences
/home/testuser/git-lfs-2.2.0/deepspeech/data/cmu/earthworm_41.wav,285092,earthworm is hermaphrodite which means that both male and female reproductive systems are present in the same individual
/home/testuser/git-lfs-2.2.0/deepspeech/data/cmu/earthworm_42.wav,346114,the male reproductive system consists of two pairs of testes in the tenth and eleventh segments with their vasa deferentia running up to the eighteenth segment
/home/testuser/git-lfs-2.2.0/deepspeech/data/cmu/earthworm_43.wav,266702,here the vasa deferentia and the duct of the prostate gland join to form a common prostrate and spermatic duct
/home/testuser/git-lfs-2.2.0/deepspeech/data/cmu/earthworm_45.wav,200664,in the seventeenth and nineteenth segments a pair of accessory glands is found in each segment
/home/testuser/git-lfs-2.2.0/deepspeech/data/cmu/earthworm_46.wav,352802,also each segment from the sixth to the ninth bears a pair of spermatheca which receives and stores spermatozoa during copulation
/home/testuser/git-lfs-2.2.0/deepspeech/data/cmu/earthworm_47.wav,281748,the female reproductive system consists of a pair of ovaries present on the inter segmental septum of the twelfth and thirteenth segments
/home/testuser/git-lfs-2.2.0/deepspeech/data/cmu/earthworm_48.wav,358652,below the ovaries are the ovarian funnels which continue into the oviduct and join to form a single female genital pore on the fourteenth segment
/home/testuser/git-lfs-2.2.0/deepspeech/data/cmu/earthworm_49.wav,169736,although earthworms are hermaphrodites each worm mates with another worm
/home/testuser/git-lfs-2.2.0/deepspeech/data/cmu/earthworm_4.wav,369520,similarly they also exhibit certain anatomical similarities and differences anatomy refers to the study of the internal structures or organs of an organism
/home/testuser/git-lfs-2.2.0/deepspeech/data/cmu/earthworm_50.wav,291780,while mating two worms lie in a juxtaposed position resulting in a mutual exchange of sperm between the two worms
/home/testuser/git-lfs-2.2.0/deepspeech/data/cmu/earthworm_51.wav,302646,later cocoons containing mature sperm eggs and a nutritive fluid are secreted by the gland cells of the clitellum
/home/testuser/git-lfs-2.2.0/deepspeech/data/cmu/earthworm_52.wav,174750,the eggs are fertilised by the sperm in the cocoons and are deposited in the soil
/home/testuser/git-lfs-2.2.0/deepspeech/data/cmu/earthworm_53.wav,508282,inside the cocoons embryos develop and after three weeks each cocoon produces about two to twenty baby worms these baby worms show direct development which means the larval stage is absent
/home/testuser/git-lfs-2.2.0/deepspeech/data/cmu/earthworm_54.wav,377880,we have just studied the anatomical features of the earthworm such as the body wall structure alimentary canal and circulatory nervous and reproductive systems
/home/testuser/git-lfs-2.2.0/deepspeech/data/cmu/earthworm_5.wav,440572,lets take a look at the anatomical features of an earthworm such as the body wall the alimentary canal and the circulatory excretory nervous and reproductive systems
/home/testuser/git-lfs-2.2.0/deepspeech/data/cmu/earthworm_6.wav,356982,the cross section of an earthworm shows that the body wall is covered by a thin layer of cuticle followed by a single layer of epidermis which contains secretory gland cells
/home/testuser/git-lfs-2.2.0/deepspeech/data/cmu/earthworm_7.wav,328560,below the epidermis lie two layers of muscles circular and longitudinal muscles followed by the innermost coelomic epithelium
/home/testuser/git-lfs-2.2.0/deepspeech/data/cmu/earthworm_8.wav,194812,now lets take a look at the longitudinal section of the worm to study its remaining anatomical features
/home/testuser/git-lfs-2.2.0/deepspeech/data/cmu/earthworm_9.wav,242460,you will notice a straight tube that runs from the first to the last segment of the body this tube is the alimentary canal
/home/testuser/git-lfs-2.2.0/deepspeech/data/cmu/electricity_10.wav,264398,similarly the regulator of fan b is connected in series with fan b
/home/testuser/git-lfs-2.2.0/deepspeech/data/cmu/electricity_11.wav,276102,besides fans a and b are both connected in parallel with the source of power supply
/home/testuser/git-lfs-2.2.0/deepspeech/data/cmu/electricity_12.wav,307030,so keeping this example in mind let us now learn about series and parallel connections of electric resistors
/home/testuser/git-lfs-2.2.0/deepspeech/data/cmu/electricity_13.wav,190838,in series connection of two resistors they are connected one after the other
